{
  "format": "aibt.case",
  "formatVersion": 1,
  "name": "mcp run-tests success then running",
  "tree": "success-then-running.aibt.json",
  "treeInstanceId": 1,
  "rootSeed": 0,
  "steps": [
    {
      "operation": "update",
      "updateId": 1,
      "snapshotRevision": 1,
      "timeMicroseconds": 0,
      "expect": {
        "progress": "waiting",
        "invariants": [
          {
            "kind": "no-error-diagnostics"
          }
        ]
      }
    }
  ],
  "tags": [
    "mcp",
    "run-tests"
  ]
}
