{
  "format": "aibt.case",
  "formatVersion": 1,
  "name": "budget resume",
  "tree": "Trees/minimal.aibt.json",
  "treeInstanceId": 1,
  "rootSeed": 0,
  "steps": [
    {
      "operation": "update",
      "updateId": 1,
      "snapshotRevision": 1,
      "timeMicroseconds": 0,
      "stepBudget": 0,
      "expect": {
        "progress": "suspended",
        "executedSteps": 0
      }
    },
    {
      "operation": "resume",
      "stepBudget": 2,
      "expect": {
        "progress": "completed",
        "rootStatus": "success",
        "executedSteps": 2
      }
    }
  ],
  "tags": [
    "budget",
    "resume"
  ]
}
